{
  "$schema": "../../../../schemas/ui-production-visual-evidence.schema.json",
  "id": "VISUAL.PRODUCTION.QHE.MEDIA_WORKSPACE.DESKTOP_DARK",
  "record_type": "ui-production-visual-evidence",
  "status": "experimental",
  "evidence_level": "production-rendered",
  "platform": "web-plus-native-hosts",
  "capture_id": "QHE.MEDIA_WORKSPACE.DESKTOP_DARK",
  "surface_ids": [
    "QHE.MEDIA.MODE_SWITCHER",
    "QHE.MEDIA.WORKSPACE",
    "QHE.MEDIA.ADVANCED_DISCLOSURE",
    "QHE.MEDIA.ACTION_DOCK"
  ],
  "patterns": [],
  "entrypoint": "domains/interface-grammar/visual-evidence/images/QHE/QHE.MEDIA_WORKSPACE.DESKTOP_DARK.png",
  "source_repository": "11576865/Quick-Automatic-Hardsub-Encoder",
  "source_revision": "8afdb474478a248fbca4d5fc1224e982991f3f64",
  "sha256": "15b9b0dd9bd91417d1fc84ebffb8c780e0a92717a146725bbcd6bf9e6275c581",
  "image": {
    "width": 1063,
    "height": 3505
  },
  "environment": {
    "schema_version": 1,
    "capture_id": "QHE.MEDIA_WORKSPACE.DESKTOP_DARK",
    "surface_ids": [
      "QHE.MEDIA.MODE_SWITCHER",
      "QHE.MEDIA.WORKSPACE",
      "QHE.MEDIA.ADVANCED_DISCLOSURE",
      "QHE.MEDIA.ACTION_DOCK"
    ],
    "adapter": "playwright-web",
    "evidence_level": "production-rendered",
    "browser": {
      "name": "chromium",
      "version": "156.0.8078.4"
    },
    "target_url": "http://127.0.0.1:4174/",
    "viewport": {
      "width": 1365,
      "height": 900,
      "deviceScaleFactor": 1
    },
    "color_scheme": "dark",
    "locale": "zh-CN",
    "selector": "#mediaWorkspace",
    "fixture": {
      "state": "manual-media",
      "open_details": true
    },
    "page_errors": []
  },
  "capture_contract": {
    "adapter": "playwright-web",
    "route": "/",
    "selector": "#mediaWorkspace",
    "capture_region": "element",
    "viewport": {
      "width": 1365,
      "height": 900,
      "device_scale_factor": 1
    },
    "device": null,
    "ready": {
      "selector": "#mediaWorkspace",
      "state": "visible",
      "settle_ms": 800
    }
  },
  "change_status": "changed",
  "previous_sha256": "055bb541006c3a1f830c02bcd2b5388a9701922af684cee222f53ea19cabb91b",
  "limitations": [
    "Production UI rendered in browser-only mode; native backend execution is not active."
  ],
  "provenance": [
    {
      "source_type": "repository",
      "source": "11576865/Quick-Automatic-Hardsub-Encoder",
      "revision": "8afdb474478a248fbca4d5fc1224e982991f3f64",
      "evidence_level": "production-rendered"
    },
    {
      "source_type": "capture-contract",
      "source": "11576865/Quick-Automatic-Hardsub-Encoder:ui-visual-capture.json",
      "revision": "8afdb474478a248fbca4d5fc1224e982991f3f64",
      "evidence_level": "source-owned capture declaration"
    }
  ]
}
