{
  "$schema": "../../../../schemas/ui-production-visual-evidence.schema.json",
  "id": "VISUAL.PRODUCTION.HSR.LAYOUT.WORKBENCH.DESKTOP_DARK",
  "record_type": "ui-production-visual-evidence",
  "status": "experimental",
  "evidence_level": "production-rendered",
  "platform": "web",
  "capture_id": "HSR.LAYOUT.WORKBENCH.DESKTOP_DARK",
  "surface_ids": [
    "HSR.WORKSPACE.LAYOUT",
    "HSR.LAYOUT.PREVIEW_WORKBENCH",
    "HSR.LAYOUT.PREVIEW_INSPECTOR",
    "HSR.LAYOUT.INSPECTOR_SECTIONS"
  ],
  "patterns": [
    "UIGS.COMPOSITION.PREVIEW_INSPECTOR_SPLIT",
    "UIGS.INSPECTOR.PROGRESSIVE_CONTROL_DISCLOSURE"
  ],
  "entrypoint": "domains/interface-grammar/visual-evidence/images/HSR/HSR.LAYOUT.WORKBENCH.DESKTOP_DARK.png",
  "source_repository": "11576865/HSR-Voice-Archive-Builder",
  "source_revision": "2d770d2be1bdb7356dc1f459049eb1d1d0bca71c",
  "sha256": "8459bafe1b3d9c278c34ee8706824dc313c5311635aaee1cb7983fdc2de6ba73",
  "image": {
    "width": 1169,
    "height": 1121
  },
  "environment": {
    "schema_version": 1,
    "capture_id": "HSR.LAYOUT.WORKBENCH.DESKTOP_DARK",
    "surface_ids": [
      "HSR.WORKSPACE.LAYOUT",
      "HSR.LAYOUT.PREVIEW_WORKBENCH",
      "HSR.LAYOUT.PREVIEW_INSPECTOR",
      "HSR.LAYOUT.INSPECTOR_SECTIONS"
    ],
    "adapter": "playwright-web",
    "evidence_level": "production-rendered",
    "browser": {
      "name": "chromium",
      "version": "156.0.8078.4"
    },
    "target_url": "http://127.0.0.1:8765/",
    "viewport": {
      "width": 1365,
      "height": 900,
      "deviceScaleFactor": 1
    },
    "color_scheme": "dark",
    "locale": "zh-CN",
    "selector": "#subtitleLayoutPreviewCard",
    "fixture": {
      "workspace": "layout"
    },
    "page_errors": []
  },
  "capture_contract": {
    "adapter": "playwright-web",
    "route": "/",
    "selector": "#subtitleLayoutPreviewCard",
    "capture_region": "element",
    "viewport": {
      "width": 1365,
      "height": 900,
      "device_scale_factor": 1
    },
    "device": null,
    "ready": {
      "selector": "#subtitleLayoutPreviewCard",
      "state": "visible",
      "settle_ms": 900
    }
  },
  "change_status": "changed",
  "previous_sha256": "b6dfe78e718e7a8c22130bc1cd23a91f86b752832080337257f5c9ddcf1953f9",
  "limitations": [
    "Production layout UI; not classified as runtime-backed libass evidence.",
    "The capture harness reveals the real production panel when it is normally gated by active-project state; it does not fabricate project data."
  ],
  "provenance": [
    {
      "source_type": "repository",
      "source": "11576865/HSR-Voice-Archive-Builder",
      "revision": "2d770d2be1bdb7356dc1f459049eb1d1d0bca71c",
      "evidence_level": "production-rendered"
    },
    {
      "source_type": "capture-contract",
      "source": "11576865/HSR-Voice-Archive-Builder:ui-visual-capture.json",
      "revision": "2d770d2be1bdb7356dc1f459049eb1d1d0bca71c",
      "evidence_level": "source-owned capture declaration"
    }
  ]
}
