{
  "$schema": "../../../../schemas/ui-production-visual-evidence.schema.json",
  "id": "VISUAL.PRODUCTION.ASS.EFFECTS_TOOL.FIXTURE_LANDSCAPE",
  "record_type": "ui-production-visual-evidence",
  "status": "experimental",
  "evidence_level": "production-rendered",
  "platform": "android",
  "capture_id": "ASS.EFFECTS_TOOL.FIXTURE_LANDSCAPE",
  "surface_ids": [
    "ASS.TOOL.EFFECTS"
  ],
  "patterns": [
    "UIGS.WORKSPACE.SCOPE_TRANSPARENCY"
  ],
  "entrypoint": "domains/interface-grammar/visual-evidence/images/ASS/ASS.EFFECTS_TOOL.FIXTURE_LANDSCAPE.png",
  "source_repository": "11576865/ASS-Workbench-Android",
  "source_revision": "aab36c875d1ca2ba8d9922e7c085993718665655",
  "sha256": "efc04c305837db9a1187918bdb6f122046e9bb6fd91a85fb21ddaf927e638469",
  "image": {
    "width": 1600,
    "height": 1000
  },
  "environment": {
    "schema_version": 1,
    "adapter": "android-emulator-screencap",
    "emulator": {
      "api_level": 35,
      "target": "google_apis",
      "arch": "x86_64",
      "profile": "pixel_6"
    },
    "logical_size": {
      "width": 1600,
      "height": 1000
    },
    "density": 240,
    "font_scale": 1.0,
    "capture_surface": "android-compositor",
    "orientation_lock": "natural-0 + wide wm size",
    "declared_orientation": "landscape",
    "theme": "dark",
    "state_source": "io.github.assworkbench.app/.EditorRegressionHostActivity",
    "instrumentation_test": "io.github.assworkbench.app.UigsVisualCaptureInstrumentedTest",
    "fixture_kind": "debug-regression-host",
    "fixture_source": "EditorRegressionHostActivity.restoreDeterministicFixture",
    "fixture_state": "restore deterministic two-line ASS fixture; focus Event 1; fixed EFFECTS tool"
  },
  "capture_contract": {
    "adapter": "android-emulator-screencap",
    "route": null,
    "selector": null,
    "capture_region": null,
    "viewport": null,
    "device": {
      "api_level": 35,
      "target": "google_apis",
      "arch": "x86_64",
      "profile": "pixel_6",
      "logical_size": {
        "width": 1600,
        "height": 1000
      },
      "density": 240,
      "locale": "zh-CN",
      "font_scale": 1,
      "orientation": "landscape"
    },
    "ready": {
      "test_tag": "fixed-inspector",
      "state": "instrumentation-test-complete",
      "settle_ms": 250
    }
  },
  "change_status": "unchanged",
  "previous_sha256": "efc04c305837db9a1187918bdb6f122046e9bb6fd91a85fb21ddaf927e638469",
  "limitations": [
    "Uses the debug-only regression host to inject deterministic app state while rendering the production ModernEditorScreen and EditorViewModel.",
    "Renderer/video runtime pixels are not active in this fixed-tool state.",
    "Screenshot is captured from Android UiAutomation at full-display compositor level."
  ],
  "provenance": [
    {
      "source_type": "repository",
      "source": "11576865/ASS-Workbench-Android",
      "revision": "aab36c875d1ca2ba8d9922e7c085993718665655",
      "evidence_level": "production-rendered"
    },
    {
      "source_type": "capture-contract",
      "source": "11576865/ASS-Workbench-Android:ui-visual-capture.json",
      "revision": "aab36c875d1ca2ba8d9922e7c085993718665655",
      "evidence_level": "source-owned capture declaration"
    }
  ]
}
