{
  "$schema": "../../../../schemas/ui-production-visual-evidence.schema.json",
  "id": "VISUAL.PRODUCTION.HSR.REVIEW.WORKBENCH.DESKTOP_DARK",
  "record_type": "ui-production-visual-evidence",
  "status": "experimental",
  "evidence_level": "production-rendered",
  "platform": "web",
  "capture_id": "HSR.REVIEW.WORKBENCH.DESKTOP_DARK",
  "surface_ids": [
    "HSR.WORKSPACE.REVIEW",
    "HSR.REVIEW.PROOFREADING_WORKSPACE",
    "HSR.REVIEW.SUBTITLE_SIDEBAR",
    "HSR.REVIEW.SUBTITLE_EDITOR"
  ],
  "patterns": [],
  "entrypoint": "domains/interface-grammar/visual-evidence/images/HSR/HSR.REVIEW.WORKBENCH.DESKTOP_DARK.png",
  "source_repository": "11576865/HSR-Voice-Archive-Builder",
  "source_revision": "1e316aca274f4fb3d3c46d3259172208a7402829",
  "sha256": "2e3dabd068685b46c0d358bf00ea82874fa954cbadff05adc56bff399a862aff",
  "image": {
    "width": 1169,
    "height": 1021
  },
  "environment": {
    "schema_version": 1,
    "capture_id": "HSR.REVIEW.WORKBENCH.DESKTOP_DARK",
    "surface_ids": [
      "HSR.WORKSPACE.REVIEW",
      "HSR.REVIEW.PROOFREADING_WORKSPACE",
      "HSR.REVIEW.SUBTITLE_SIDEBAR",
      "HSR.REVIEW.SUBTITLE_EDITOR"
    ],
    "adapter": "playwright-web",
    "evidence_level": "production-rendered",
    "browser": {
      "name": "chromium",
      "version": "156.0.8078.4"
    },
    "target_url": "http://127.0.0.1:8765/",
    "viewport": {
      "width": 1365,
      "height": 900,
      "deviceScaleFactor": 1
    },
    "color_scheme": "dark",
    "locale": "zh-CN",
    "selector": "#subtitleReviewCard",
    "fixture": {
      "workspace": "review"
    },
    "page_errors": []
  },
  "capture_contract": {
    "adapter": "playwright-web",
    "route": "/",
    "selector": "#subtitleReviewCard",
    "capture_region": "element",
    "viewport": {
      "width": 1365,
      "height": 900,
      "device_scale_factor": 1
    },
    "device": null,
    "ready": {
      "selector": "#subtitleReviewCard",
      "state": "visible",
      "settle_ms": 900
    }
  },
  "change_status": "changed",
  "previous_sha256": "cca72e1e110b78a3f6a446d9c31ad2f26b4ede2ffd1a785ece16320803f5e9fd",
  "limitations": [
    "Deterministic no-active-project review state.",
    "The capture harness reveals the real production panel when it is normally gated by active-project state; it does not fabricate project data."
  ],
  "provenance": [
    {
      "source_type": "repository",
      "source": "11576865/HSR-Voice-Archive-Builder",
      "revision": "1e316aca274f4fb3d3c46d3259172208a7402829",
      "evidence_level": "production-rendered"
    },
    {
      "source_type": "capture-contract",
      "source": "11576865/HSR-Voice-Archive-Builder:ui-visual-capture.json",
      "revision": "1e316aca274f4fb3d3c46d3259172208a7402829",
      "evidence_level": "source-owned capture declaration"
    }
  ]
}
