{
  "$schema": "../../../../schemas/ui-production-visual-evidence.schema.json",
  "id": "VISUAL.PRODUCTION.HSR.LAYOUT.WORKBENCH.MOBILE_DARK",
  "record_type": "ui-production-visual-evidence",
  "status": "experimental",
  "evidence_level": "production-rendered",
  "platform": "web",
  "capture_id": "HSR.LAYOUT.WORKBENCH.MOBILE_DARK",
  "surface_ids": [
    "HSR.WORKSPACE.LAYOUT",
    "HSR.LAYOUT.PREVIEW_WORKBENCH",
    "HSR.LAYOUT.PREVIEW_INSPECTOR",
    "HSR.LAYOUT.INSPECTOR_SECTIONS"
  ],
  "patterns": [
    "UIGS.COMPOSITION.PREVIEW_INSPECTOR_SPLIT",
    "UIGS.INSPECTOR.PROGRESSIVE_CONTROL_DISCLOSURE"
  ],
  "entrypoint": "domains/interface-grammar/visual-evidence/images/HSR/HSR.LAYOUT.WORKBENCH.MOBILE_DARK.png",
  "source_repository": "11576865/HSR-Voice-Archive-Builder",
  "source_revision": "fd9dfca282c7fce7806b37d748261337da3bc831",
  "sha256": "134735a7d4d970ee73c4a5235d88edb9480a833ccf64d72bbd44e6cbd4529a16",
  "image": {
    "width": 390,
    "height": 844
  },
  "environment": {
    "schema_version": 1,
    "capture_id": "HSR.LAYOUT.WORKBENCH.MOBILE_DARK",
    "surface_ids": [
      "HSR.WORKSPACE.LAYOUT",
      "HSR.LAYOUT.PREVIEW_WORKBENCH",
      "HSR.LAYOUT.PREVIEW_INSPECTOR",
      "HSR.LAYOUT.INSPECTOR_SECTIONS"
    ],
    "adapter": "playwright-web",
    "evidence_level": "production-rendered",
    "browser": {
      "name": "chromium",
      "version": "156.0.8078.4"
    },
    "target_url": "http://127.0.0.1:8765/",
    "viewport": {
      "width": 390,
      "height": 844,
      "deviceScaleFactor": 1
    },
    "color_scheme": "dark",
    "locale": "zh-CN",
    "selector": "#subtitleLayoutPreviewCard",
    "fixture": {
      "workspace": "layout"
    },
    "page_errors": []
  },
  "capture_contract": {
    "adapter": "playwright-web",
    "route": "/",
    "selector": "#subtitleLayoutPreviewCard",
    "capture_region": "viewport",
    "viewport": {
      "width": 390,
      "height": 844,
      "device_scale_factor": 1
    },
    "device": null,
    "ready": {
      "selector": "#subtitleLayoutPreviewCard",
      "state": "visible",
      "settle_ms": 900
    }
  },
  "change_status": "unchanged",
  "previous_sha256": "134735a7d4d970ee73c4a5235d88edb9480a833ccf64d72bbd44e6cbd4529a16",
  "limitations": [
    "Phone viewport and inspector action visibility only.",
    "Not runtime-backed libass verification; no active project data is fabricated."
  ],
  "provenance": [
    {
      "source_type": "repository",
      "source": "11576865/HSR-Voice-Archive-Builder",
      "revision": "fd9dfca282c7fce7806b37d748261337da3bc831",
      "evidence_level": "production-rendered"
    },
    {
      "source_type": "capture-contract",
      "source": "11576865/HSR-Voice-Archive-Builder:ui-visual-capture.json",
      "revision": "fd9dfca282c7fce7806b37d748261337da3bc831",
      "evidence_level": "source-owned capture declaration"
    }
  ]
}
