{
  "$schema": "../../../../schemas/ui-production-visual-evidence.schema.json",
  "id": "VISUAL.PRODUCTION.HSR.LAYOUT.WORKBENCH.TABLET_DARK",
  "record_type": "ui-production-visual-evidence",
  "status": "experimental",
  "evidence_level": "production-rendered",
  "platform": "web",
  "capture_id": "HSR.LAYOUT.WORKBENCH.TABLET_DARK",
  "surface_ids": [
    "HSR.WORKSPACE.LAYOUT",
    "HSR.LAYOUT.PREVIEW_WORKBENCH",
    "HSR.LAYOUT.PREVIEW_INSPECTOR",
    "HSR.LAYOUT.INSPECTOR_SECTIONS"
  ],
  "patterns": [
    "UIGS.COMPOSITION.PREVIEW_INSPECTOR_SPLIT",
    "UIGS.INSPECTOR.PROGRESSIVE_CONTROL_DISCLOSURE"
  ],
  "entrypoint": "domains/interface-grammar/visual-evidence/images/HSR/HSR.LAYOUT.WORKBENCH.TABLET_DARK.png",
  "source_repository": "11576865/HSR-Voice-Archive-Builder",
  "source_revision": "1e316aca274f4fb3d3c46d3259172208a7402829",
  "sha256": "426decc74d6c2fceb2174ab61a19234e56fc41b266416b29f12ba6ba438d3eec",
  "image": {
    "width": 1024,
    "height": 900
  },
  "environment": {
    "schema_version": 1,
    "capture_id": "HSR.LAYOUT.WORKBENCH.TABLET_DARK",
    "surface_ids": [
      "HSR.WORKSPACE.LAYOUT",
      "HSR.LAYOUT.PREVIEW_WORKBENCH",
      "HSR.LAYOUT.PREVIEW_INSPECTOR",
      "HSR.LAYOUT.INSPECTOR_SECTIONS"
    ],
    "adapter": "playwright-web",
    "evidence_level": "production-rendered",
    "browser": {
      "name": "chromium",
      "version": "156.0.8078.4"
    },
    "target_url": "http://127.0.0.1:8765/",
    "viewport": {
      "width": 1024,
      "height": 900,
      "deviceScaleFactor": 1
    },
    "color_scheme": "dark",
    "locale": "zh-CN",
    "selector": "#subtitleLayoutPreviewCard",
    "fixture": {
      "workspace": "layout"
    },
    "page_errors": []
  },
  "capture_contract": {
    "adapter": "playwright-web",
    "route": "/",
    "selector": "#subtitleLayoutPreviewCard",
    "capture_region": "viewport",
    "viewport": {
      "width": 1024,
      "height": 900,
      "device_scale_factor": 1
    },
    "device": null,
    "ready": {
      "selector": "#subtitleLayoutPreviewCard",
      "state": "visible",
      "settle_ms": 900
    }
  },
  "change_status": "changed",
  "previous_sha256": "163118327a45496f57d6bd8bbaea8d6eb5ec3ebcd4255bd0bff3ca5f321b9b7f",
  "limitations": [
    "Tablet layout and editable control hierarchy only.",
    "Not runtime-backed libass verification; no active project data is fabricated."
  ],
  "provenance": [
    {
      "source_type": "repository",
      "source": "11576865/HSR-Voice-Archive-Builder",
      "revision": "1e316aca274f4fb3d3c46d3259172208a7402829",
      "evidence_level": "production-rendered"
    },
    {
      "source_type": "capture-contract",
      "source": "11576865/HSR-Voice-Archive-Builder:ui-visual-capture.json",
      "revision": "1e316aca274f4fb3d3c46d3259172208a7402829",
      "evidence_level": "source-owned capture declaration"
    }
  ]
}
