{
  "$schema": "../../../../schemas/ui-production-visual-evidence.schema.json",
  "id": "VISUAL.PRODUCTION.MKV.OUTPUT_HUB.DESKTOP_DARK",
  "record_type": "ui-production-visual-evidence",
  "status": "experimental",
  "evidence_level": "production-rendered",
  "platform": "web",
  "capture_id": "MKV.OUTPUT_HUB.DESKTOP_DARK",
  "surface_ids": [
    "MKV.STAGE.OUTPUT_HUB",
    "MKV.OUTPUT.SUMMARY",
    "MKV.OUTPUT.MUX_PLAN",
    "MKV.OUTPUT.EXECUTION"
  ],
  "patterns": [
    "UIGS.WORKSPACE.STICKY_SUPPORTING_PANE"
  ],
  "entrypoint": "domains/interface-grammar/visual-evidence/images/MKV/MKV.OUTPUT_HUB.DESKTOP_DARK.png",
  "source_repository": "11576865/MKV-Fast-Muxer",
  "source_revision": "60d41336ed7d6df5a422001289824510ea823d9e",
  "sha256": "df9bb569a097892d23ba205ea0e1039dea21ec28079f3162e7b8b9153e45ec74",
  "image": {
    "width": 1134,
    "height": 559
  },
  "environment": {
    "schema_version": 1,
    "capture_id": "MKV.OUTPUT_HUB.DESKTOP_DARK",
    "surface_ids": [
      "MKV.STAGE.OUTPUT_HUB",
      "MKV.OUTPUT.SUMMARY",
      "MKV.OUTPUT.MUX_PLAN",
      "MKV.OUTPUT.EXECUTION"
    ],
    "adapter": "playwright-web",
    "evidence_level": "production-rendered",
    "browser": {
      "name": "chromium",
      "version": "156.0.8078.4"
    },
    "target_url": "http://127.0.0.1:4173/",
    "viewport": {
      "width": 1180,
      "height": 900,
      "deviceScaleFactor": 1
    },
    "color_scheme": "dark",
    "locale": "zh-CN",
    "selector": ".output-hub"
  },
  "capture_contract": {
    "adapter": "playwright-web",
    "route": "/",
    "selector": ".output-hub",
    "capture_region": "element",
    "viewport": {
      "width": 1180,
      "height": 900,
      "device_scale_factor": 1
    },
    "device": null,
    "ready": {
      "selector": ".output-hub",
      "state": "visible",
      "settle_ms": 800
    }
  },
  "change_status": "changed",
  "previous_sha256": "4123f91e38b170fbda6e45039a5d8fee756a55642b485d8e60414a1cf8417952",
  "limitations": [
    "No mux job is executed; summary, plan and execution surfaces are the real production pre-execution state."
  ],
  "provenance": [
    {
      "source_type": "repository",
      "source": "11576865/MKV-Fast-Muxer",
      "revision": "60d41336ed7d6df5a422001289824510ea823d9e",
      "evidence_level": "production-rendered"
    },
    {
      "source_type": "capture-contract",
      "source": "11576865/MKV-Fast-Muxer:ui-visual-capture.json",
      "revision": "60d41336ed7d6df5a422001289824510ea823d9e",
      "evidence_level": "source-owned capture declaration"
    }
  ]
}
